Danger Girl para PlayStation 1/ps1 #1;22,99 EUR;+ 9,99 EUR de envío;desde Alemania;
Danger Girl/disco solamente/Playstation 1 PS1 PS2;4,66 EUR;+ 16,47 EUR de envío estimado;desde Reino Unido;
Danger Girl | Playstation PS1 | Completo | PAL;23,34 EUR;+ 16,81 EUR de envío estimado;desde Reino Unido;
Danger Girl Sony Playstation PS One Juego versión en ruso;6,90 EUR;+ 7,76 EUR de envío;desde Ucrania;
Danger Girl Sony PlayStation 1, Ps1, Psone THQ;11,62 EUR;+ 16,60 EUR de envío estimado;desde Reino Unido;
PlayStation revista Metal Gear Solid 2 Danger Girl Fear Effect 2 gran turismo 3;17,99 EUR;+ 16,99 EUR de envío;desde Alemania;
Danger Girl. PS1 Juego. completa. (PlayStation One, PS2, PS3. PAL);23,00 EUR;+ 20,24 EUR de envío estimado;desde Reino Unido;
Danger Girl de Playstation (PAL) (Completo);19,95 EUR;+ 15,95 EUR de envío;desde España;
Danger Girl * ps1 PlayStation 1 * buen estado * probado * completamente;24,99 EUR;Envío no especificado;desde Alemania;
Danger Girl PS1 PlayStation 1 ntsc U/C completo funzionante black label ;24,99 EUR;Envío no especificado;desde Italia;
Danger Girl (Sony PlayStation 1, 2000) PS1 auténtico Black Label #1643;28,45 EUR;Envío gratis;desde Estados Unidos;
Danger Girl Playstation, (PS1);12,93 EUR;Envío gratis;desde Estados Unidos;
Danger Girl Sony Playstation PS1 Cartucho Completo en Caja con Manual del juego Black Label;31,91 EUR;Envío gratis;desde Estados Unidos;
Danger Girl (Sony PlayStation 1, 2000) PS1 auténtico black label;37,04 EUR;Envío gratis;desde Estados Unidos;
Danger Girl (Sony PlayStation 1 PS1, 2000) Completo Cartucho en Caja probado y limpiado!;33,19 EUR;Envío gratis;desde Estados Unidos;
Danger Girl (Sony PlayStation 1, 2000) Completo Funciona-Probado Y;36,86 EUR;Envío gratis;desde Estados Unidos;
Danger Girl (Sony PlayStation 1 PS1, 2000) Black Label Con Cubierta;34,48 EUR;+ 2,75 EUR de envío;desde Estados Unidos;
Danger Girl (Sony PlayStation 1 PS1, 2000) Black Label No Manual Probado;21,56 EUR;Envío gratis;desde Estados Unidos;
Danger Girl (Sony PlayStation 1, 2000) Completo;30,14 EUR;+ 4,27 EUR de envío;desde Estados Unidos;
Danger Girl (Sony Playstation) PS1 completa Completo en Caja Juego Black Label probada! genial!;38,78 EUR;desde Estados Unidos;
Danger Girl Solo Manual (Sony PlayStation 1, 2000) PS1, ver fotos en busca de daños;6,90 EUR;Envío gratis;desde Estados Unidos;
Danger Girl Playstation 1 PS1 juego Antiguo J. Scott Campbell 2000 arte cartel AD;12,93 EUR;desde Estados Unidos;
Danger Girl (Sony PlayStation 1, 2000) Completo En Caja;51,73 EUR;+ 4,74 EUR de envío;desde Estados Unidos;
Danger Girl (Sony PlayStation 1, 2000) PS1 PSOne PSX 2 3 Cartucho en Caja Black Label Como Nuevo ✅;38,80 EUR;+ 4,44 EUR de envío;desde Estados Unidos;
Danger Girl Playstation PS2 video juego Publicidad Revista Arte Impresión Original;15,09 EUR;Envío gratis;desde Estados Unidos;
Danger Girl (2000) - Sony Playstation-disco solamente;19,82 EUR;Envío gratis;desde Estados Unidos;
Danger Girl (Sony PlayStation PS1, 2000);47,62 EUR;+ 3,74 EUR de envío;desde Canadá;
Danger Girl Sony Playstation PS1 Original Black Label Nueva Sellado de fábrica;85,37 EUR;+ 4,74 EUR de envío;desde Estados Unidos;
Danger Girl PS1 Playstation 1 Game + Manual PAL oz169;24,38 EUR;+ 16,90 EUR de envío;desde Australia;
Danger Girl PS1 SONY PLAYSTATION 1 2000 Pulido Disco Solamente ENVÍO GRATUITO;17,24 EUR;Envío gratis;desde Estados Unidos;
Danger Girl PS1 SONY PLAYSTATION 1 2000 disco solamente;24,14 EUR;Envío gratis;desde Estados Unidos;
Danger Girl (Sony PlayStation 1, 2000) Completo Envío Rápido Gratis Como Nuevo;48,28 EUR;Envío gratis;desde Estados Unidos;
Danger Girl PS1 SONY PLAYSTATION ONE 2000 cómics Campbell;21,56 EUR;Envío gratis;desde Estados Unidos;
Danger Girl (Sony PlayStation 1, 2000) (pre Completa;34,48 EUR;+ 4,44 EUR de envío;desde Estados Unidos;
Danger Girl PLAYSTATION 1;30,14 EUR;+ 6,90 EUR de envío;desde Estados Unidos;
Danger Girl Playstation 1 disco solamente;17,25 EUR;+ 3,71 EUR de envío;desde Estados Unidos;
Hunter-Killer 0 alemán Variant-cover-Edition Scott Campbell (Danger Girl) sexy;9,99 EUR;+ 10,00 EUR de envío;desde Alemania;
Danger Girl Back In Black 1-4 VF/NM;8,17 EUR;+ 18,67 EUR de envío estimado;desde Reino Unido;
Danger Girl Special #1 1999 Dynamic Forces Wildstorm Comic New and Sealed;7,59 EUR;+ 16,52 EUR de envío estimado;desde Reino Unido;
Danger Girl  #4 NM (Image Comics) Campbell / Hartnell ref: A4.1996;4,66 EUR;+ 10,51 EUR de envío;desde Reino Unido;
Danger Girl: Renegade #1;4,03 EUR;+ 10,51 EUR de envío;desde Reino Unido;
Danger Girl Body Shots #2 to #4 (Wildstorm 2007) 3 x issues.;23,29 EUR;+ 11,09 EUR de envío;desde Reino Unido;
Danger Girl #2 to #5 (image 1998). 4 x High Grade issues.;40,28 EUR;+ 14,59 EUR de envío;desde Reino Unido;
Danger Girl 1,2,3,4,5,6 scott campbell us cliffhanger Comics;18,00 EUR;+ 7,90 EUR de envío;desde Alemania;
 Danger Girl Comic Market Foil Cover & Danger Girl #1 Chrome Cover.;180,96 EUR;+ 49,79 EUR de envío estimado;desde Reino Unido;
Danger Girl Viva Las Danger #1 One-Shot Cliffhanger Comics 2004 Sent In Mailer;6,41 EUR;+ 16,50 EUR de envío estimado;desde Reino Unido;
Danger Girl Special Wetsuit Dynamic Forces Variant VF/NM;14,01 EUR;+ 18,77 EUR de envío estimado;desde Reino Unido;
Danger Girl Twenty Years Smoking Gun Virgin J. Scott Campbell;75,89 EUR;+ 33,69 EUR de envío estimado;desde Reino Unido;
Danger Girl # 5  Jeff Scott Campbell N mint 1st print  Image Comics;2,92 EUR;+ 9,34 EUR de envío;desde Reino Unido;
Danger Girl #2 Gold Foil Edition Signed J Scott Campbell Dynamic Forces COA;23,34 EUR;+ 25,02 EUR de envío estimado;desde Reino Unido;
Danger Girl Trinity TP [aug130419] IDW Publishing;17,10 EUR;+ 10,00 EUR de envío;desde Alemania;
Danger Girl Revolver 1 2 3 ;14,01 EUR;+ 16,64 EUR de envío estimado;desde Reino Unido;
Danger Girl: Hawaiian Punch (alemán) - campbell-Dino Verlag 2003-Top;9,99 EUR;Envío no especificado;desde Alemania;
Danger Girl (alemán) dino a partir de #1 + todos Variant-cover scott campbell cliffhanger;2,99 EUR a 14,99 EUR;+ 8,00 EUR de envío;desde Alemania;
Danger Girl Hawaiian Punch #1 VF+ 1st Print Cliffhanger Comics;3,49 EUR;+ 6,42 EUR de envío;desde Reino Unido;
Danger Girl #4 VF+ 1st Print Image Cliffhanger Comics;2,92 EUR;+ 6,42 EUR de envío;desde Reino Unido;
Danger Girl #6 VF+ 1st Print Cliffhanger Comics;2,92 EUR;+ 6,42 EUR de envío;desde Reino Unido;
Comics VF - Danger Girl  Volume 1;5,00 EUR;+ 13,00 EUR de envío;desde Francia;
Nuevo anuncioDanger Girl Kamikaze 1 & 2 *DC Cliffhanger, 2001, UK Seller*;3,49 EUR;+ 12,83 EUR de envío;desde Reino Unido;
Danger Girl # 3  Jeff Scott Campbell N mint 1st print  Image Comics;3,44 EUR;+ 9,34 EUR de envío;desde Reino Unido;
Danger Girl Special #1 Mod Bods Flip Cover (2000) Mint. Bagged & Boarded Comic;5,84 EUR;+ 16,50 EUR de envío estimado;desde Reino Unido;
Danger Girl Kamikaze #1;3,44 EUR;+ 10,51 EUR de envío;desde Reino Unido;
