Sony PS1 PLAYSTATION-Final Fantasy Collection Raro Importado De Jap칩n NTSC-J 游 游;35,01 EUR;+ 17,02 EUR de env칤o estimado;Vendidos  12 sep 2021Art칤culo vendido;desde Reino Unido;
Final Fantasy Collection Playstation 1 * claro * Tarjeta de memoria Jap칩n/US PS1 oficial;14,65 EUR;+3,88 EUR de env칤o;Vendidos  5 sep 2021Art칤culo vendido;desde Estados Unidos;
Final Fantasy Collection (Sony Playstation 1,1999) de Jap칩n;16,04 EUR;+6,04 EUR de env칤o;Vendidos  3 sep 2021Art칤culo vendido;desde Jap칩n;
Final Fantasy Collection aniversario Paquete Sony Playstation Square Enix;86,22 EUR;Env칤o internacional gratis;Vendidos  23 ago 2021Art칤culo vendido;desde Jap칩n;
Final Fantasy Collection Playstation 1 PS1 exclusivo de Jap칩n. completa;20,70 EUR;+3,45 EUR de env칤o;Vendidos  11 ago 2021Art칤culo vendido;desde Estados Unidos;
Final Fantasy Collection con la columna tarjeta PS1 Sony PlayStation;38,80 EUR;+15,52 EUR de env칤o;Vendidos  28 jul 2021Art칤culo vendido;desde Jap칩n;
Final Fantasy Collection 4 5 6 7 8 9 Lote de 4 Sony PlayStation PS1;51,74 EUR;Env칤o internacional gratis;Vendidos  18 jul 2021Art칤culo vendido;desde Jap칩n;
Final Fantasy Collection aniversario paquete PLAYSTATION;202,65 EUR;Env칤o gratis;Vendidos  15 jul 2021Art칤culo vendido;desde Estados Unidos;
Final Fantasy Collection Anniversary Package - Sony PS1 - NTSC-J JAP JAPAN - TBE;109,90 EUR;+24,90 EUR de env칤o;Vendidos  29 jul 2021Art칤culo vendido;desde Francia;
