Growlanser Generations Sony Playstation 2 PS2 BRAND NEW FACTORY SEALED;199,99 EUR;+ 29,40 EUR de envío;desde Francia;
Playstation 2 Juego: Growlanser: patrimonio de guerra (excelente condición de sellado) PAL Reino Unido;233,49 EUR;+ 13,37 EUR de envío;desde Reino Unido;
Growlanser VI Precarious World PlayStation 2 NTSC-J Japan Import;26,99 EUR;+ 19,50 EUR de envío;desde España;
Growlanser generations Deluxe | PlayStation 2 ps2 | nuevo sealed VGA 85+ oro;799,90 EUR;+ 44,99 EUR de envío;desde Alemania;
Growlanser Wayfarer de tiempo-inglés-Completo-PlayStation PSP Portable;116,74 EUR;+ 11,66 EUR de envío;desde Reino Unido;
Growlanser legado de guerra por PLAYSTATION 2 para PS2 tienen muy raro y difícil de encontrar";116,74 EUR;+ 15,18 EUR de envío;desde Reino Unido;
Growlanser: Heritage of War (Sony PlayStation 2, 2008) Brand new;229,99 EUR;Envío no especificado;desde Portugal;
Nuevo anuncioGrowlanser: generaciones (Sony PlayStation 2, 2004), Cartucho en Caja;77,60 EUR;+ 4,48 EUR de envío;desde Estados Unidos;
Growlanser: generaciones PS2-completa (Sony PlayStation 2, 2004);77,60 EUR;+ 5,39 EUR de envío;desde Estados Unidos;
Growlanser: generaciones (Sony PlayStation 2, 2004) Completo-Probado Y Funcionando;102,57 EUR;+ 7,59 EUR de envío;desde Estados Unidos;
Growlanser: generaciones (Sony PlayStation 2, 2004);60,36 EUR;+ 4,44 EUR de envío;desde Estados Unidos;
Growlanser: Generations Deluxe Edition (Sony PlayStation 2, 2004) PS2 hallazgo raro;172,46 EUR;Envío gratis;desde Estados Unidos;
