Sony Playstation 1 Terry Pratchett Discworld Noir Juego;80,56 EUR;+ 26,64 EUR de envío estimado;desde Reino Unido;
Playstation 1 Discworld Noir PS 1 PAL only Disc with Manual;39,90 EUR;+ 16,20 EUR de envío;desde Austria;
Discworld Noir - PS1 Loose Version PAL PlayStation Sony;79,95 EUR;+ 9,00 EUR de envío;desde Francia;
Gioco Play Station Ps1 - Discworld Noir [1999 vintage RARO games];39,90 EUR;Envío no especificado;desde Italia;
Terry Pratchett Discworld Noir Aventura Juego PC CD-ROM;8,16 EUR;+ 8,11 EUR de envío;desde Reino Unido;
Terry Pratchett Discworld Noir JUEGO PC EDICIÓN caja grande pal raro;34,97 EUR;+ 17,02 EUR de envío estimado;desde Reino Unido;
Discworld Noir EURO VERSION ITA-UK-ESP PC CD Big Box NEW! SIGILLATO SEALED! RARE;129,99 EUR;+ 26,00 EUR de envío;desde Italia;
3-Terry Pratchett Discworld Noir Juego de PC-rápido post-Completo;5,78 EUR;+ 6,95 EUR de envío;desde Reino Unido;
Terry Pratchett Discworld Noir Aventura Juego PC CD-ROM;8,16 EUR;+ 16,53 EUR de envío estimado;desde Reino Unido;
Discworld Noir Adventure Game PC ita eng esp;6,99 EUR;+ 39,00 EUR de envío;desde Italia;
