Darklight Conflict Sony PlayStation PS1;4,90 EUR;+32,98 EUR shipping estimate;Sold  Aug 16, 2021Sold Item;from United Kingdom;
Darklight Conflict (Cib) Sony PlayStation 1 Ps1;12,25 EUR;Free International Shipping;Sold  Sep 20, 2021Sold Item;from Canada;
Darklight Conflict (Sony PlayStation 1, 1997) PS1 Disc and Art;6,89 EUR;Free shipping;Sold  Sep 9, 2021Sold Item;from United States;
Darklight Conflict PS1 Sony PlayStation Instruction Manual Only;3,44 EUR;Free shipping;Sold  Sep 9, 2021Sold Item;from United States;
Darklight Conflict (PlayStation PS1) Brand New, Factory Sealed!;25,86 EUR;+3,00 EUR shipping;Sold  Aug 31, 2021Sold Item;from United States;
Darklight Conflict (Sony PlayStation 1, PS1 1997) Tested And Working Complete;12,37 EUR;Free shipping;Sold  Aug 25, 2021Sold Item;from United States;
Sega Saturn - Darklight Conflict Complete With Manual;9,34 EUR;+33,08 EUR shipping estimate;Sold  Aug 14, 2021Sold Item;from United Kingdom;
Darklight Conflict (PC: Windows);1,16 EUR;+34,67 EUR shipping estimate;Sold  Sep 10, 2021Sold Item;from United Kingdom;
Darklight Conflict - Sega Saturn;12,26 EUR;+20,35 EUR shipping estimate;Sold  Oct 1, 2021Sold Item;from United Kingdom;
Darklight Conflict Big Box PC Game Original Complete ;17,45 EUR;+20,21 EUR shipping estimate;Sold  Sep 9, 2021Sold Item;from United Kingdom;
