Ehrgeiz PS1 PlayStation 1 no manual Pal;70,04 EUR;+ 22,37 EUR de env칤o estimado;Vendidos  24 sep 2021Art칤culo vendido;desde Reino Unido;
God Bless the Ring Ez Ehrgeiz Squaresoft completo pal Espa침ol Psx playstation 1 ;49,95 EUR;Env칤o no especificado;Vendidos  2 sep 2021Art칤culo vendido;desde Espa침a;
Ehrgeiz: Dios bendiga el anillo de V칤deo Juego Para Sony PlayStation PS1 japon칠s 01750;23,34 EUR;+ 16,81 EUR de env칤o estimado;Vendidos  24 ago 2021Art칤culo vendido;desde Reino Unido;
Ehrgeiz: mundo de Final Fantasy 7. PS1 Juego. como Nuevo. completo PlayStation One PAL;123,70 EUR;+14,89 EUR de env칤o;Vendidos  20 jul 2021Art칤culo vendido;desde Reino Unido;
Ehrgeiz 游쉻릖좷릖쉻릖좷릖쉻릖 PSX PlayStation ;56,00 EUR;+14,00 EUR de env칤o;Vendidos  17 jul 2021Art칤culo vendido;desde Italia;
Ehrgeiz-PlayStation 1-PS1;77,04 EUR;+ 27,30 EUR de env칤o estimado;Vendidos  11 jul 2021Art칤culo vendido;desde Reino Unido;
1999 Ehrgeiz video juego poster print ad arte Playstation 1 PS1 Rara;6,89 EUR;+3,41 EUR de env칤o;Vendidos  3 oct 2021Art칤culo vendido;desde Estados Unidos;
Dios bendiga la Anillo Ehrgeiz Sony Playstation disco solamente HC2836 Usado;34,46 EUR;+3,41 EUR de env칤o;Vendidos  24 sep 2021Art칤culo vendido;desde Estados Unidos;
Ehrgeiz (Sony PlayStation 1, 1999) * Sin Manual * PS1;43,11 EUR;Env칤o gratis;Vendidos  22 sep 2021Art칤culo vendido;desde Estados Unidos;
Ehrgeiz Colecci칩n Del Milenio Cuadrado PS1 Playstation Juegos Divertidos Jap칩n Japon칠s;77,22 EUR;Env칤o internacional gratis;Vendidos  18 sep 2021Art칤culo vendido;desde Jap칩n;
Ehrgeiz Dios bendiga la Anillo Playstation 1 Juego Completo PS1 buen disco-EE. UU. NTSC;77,60 EUR;+4,18 EUR de env칤o;Vendidos  18 sep 2021Art칤culo vendido;desde Estados Unidos;
Ehrgeiz: EZ Dios bendiga la Anillo (Sony Playstation 1, PS1) - disco solamente;34,45 EUR;Env칤o gratis;Vendidos  17 sep 2021Art칤culo vendido;desde Estados Unidos;
Ehrgeiz: EZ Dios bendiga la Anillo Playstation PS1 tridimensionales probado-disco solamente;30,17 EUR;+4,44 EUR de env칤o;Vendidos  13 sep 2021Art칤culo vendido;desde Estados Unidos;
Ehrgeiz Dios bendiga este anillo Black Label (Sony PlayStation 1) ps1 Probado;68,94 EUR;+4,44 EUR de env칤o;Vendidos  8 sep 2021Art칤culo vendido;desde Estados Unidos;
Ehrgeiz Stick Controlador Con Caja Y Yo-Yo * Playstation * PS1 PS Arcade Joystick Hori;137,96 EUR;Env칤o gratis;Vendidos  7 sep 2021Art칤culo vendido;desde Estados Unidos;
Sony Playstation PS1 Dragon Ball Final Ultimate Tobal 1 2 Soul Edge Ehrgeiz Jp;41,39 EUR;+17,25 EUR de env칤o;Vendidos  5 sep 2021Art칤culo vendido;desde Jap칩n;
Sony PlayStation 1 PS1 disco y espalda Art Ehrgeiz Dios bendiga a la llamada Sin Manual;42,25 EUR;Env칤o gratis;Vendidos  5 sep 2021Art칤culo vendido;desde Estados Unidos;
Ehrgeiz: Dios bendiga la Anillo (Sony Playstation) PS1 solo manual con tarjeta de garant칤a;21,55 EUR;Env칤o gratis;Vendidos  5 sep 2021Art칤culo vendido;desde Estados Unidos;
PS1 Ehrgeiz Cuadrado Millennium Edition Sony PlayStation JAPAN #SLPS -02770;12,93 EUR;+10,35 EUR de env칤o;Vendidos  1 sep 2021Art칤culo vendido;desde Jap칩n;
Ehrgeiz: Dios bendiga la Anillo (Sony PlayStation 1) PS1 Cartucho en Caja Completo Con Tarjeta Reg;86,22 EUR;Env칤o gratis;Vendidos  1 sep 2021Art칤culo vendido;desde Estados Unidos;
Ehrgeiz Dios bendiga la Anillo Playstation 1 Juego Completo PS1 buen disco-EE. UU. NTSC;91,36 EUR;+5,39 EUR de env칤o;Vendidos  30 ago 2021Art칤culo vendido;desde Estados Unidos;
Ehrgeiz (completo, 1999) - Sony PlayStation 1, PS One, PS1;55,39 EUR;+4,21 EUR de env칤o;Vendidos  26 ago 2021Art칤culo vendido;desde Estados Unidos;
Ehrgeiz (Sony PlayStation 1) Black Label-como NUEVO-Disco PS1 PSX;86,22 EUR;Env칤o gratis;Vendidos  23 ago 2021Art칤culo vendido;desde Estados Unidos;
Ehrgeiz PS1 Cuadrado Sony PlayStation 1 de Jap칩n;2,87 EUR;+17,25 EUR de env칤o;Vendidos  18 ago 2021Art칤culo vendido;desde Jap칩n;
Caso de reemplazo Ehrgeiz PS1 personalizado no Disco -! env칤o r치pido!;11,21 EUR;Env칤o gratis;Vendidos  17 ago 2021Art칤culo vendido;desde Estados Unidos;
Ehrgeiz: EZ Dios bendiga la Anillo Playstation PS1 tridimensionales probado-disco solamente;29,28 EUR;+4,10 EUR de env칤o;Vendidos  15 ago 2021Art칤culo vendido;desde Estados Unidos;
Ehrgeiz Cuadrado PlayStation 1 PS1 Jap칩n Importaci칩n;15,50 EUR;Env칤o internacional gratis;Vendidos  14 ago 2021Art칤culo vendido;desde Jap칩n;
Ehrgeiz: Dios bendiga la Anillo (Sony Playstation) PS1 solo manual con tarjeta de garant칤a;21,55 EUR;Env칤o gratis;Vendidos  13 ago 2021Art칤culo vendido;desde Estados Unidos;
Solo Manual De Playstation 1 PS1 Dios bendiga la Anillo EZ Ehrgeiz;17,25 EUR;Env칤o gratis;Vendidos  12 ago 2021Art칤culo vendido;desde Estados Unidos;
Ehrgeiz Dios bendiga este anillo Black Label (Sony PlayStation 1) ps1 Probado;68,98 EUR;+4,74 EUR de env칤o;Vendidos  8 ago 2021Art칤culo vendido;desde Estados Unidos;
Ehrgeiz Dios bendiga la Anillo (Sony PlayStation 1 1999 PS1 PSOne 2 Black Label Como Nuevo;146,55 EUR;+2,54 EUR de env칤o;Vendidos  7 ago 2021Art칤culo vendido;desde Estados Unidos;
Ehrgeiz Dios bendiga este anillo Black Label (Sony PlayStation 1) ps1;73,29 EUR;Env칤o gratis;Vendidos  6 ago 2021Art칤culo vendido;desde Estados Unidos;
Sony PS 1 PlayStation 1 Ehrgeiz Dios bendiga completar el anillo bonito!;77,60 EUR;+7,93 EUR de env칤o;Vendidos  6 ago 2021Art칤culo vendido;desde Estados Unidos;
Ehrgeiz japon칠s Playstation PS1 Jap칩n importaci칩n Vendedor de Estados Unidos;17,24 EUR;Env칤o gratis;Vendidos  3 ago 2021Art칤culo vendido;desde Estados Unidos;
Ehrgeiz Dios bendiga este anillo Black Label (Sony PlayStation 1) ps1;73,29 EUR;Env칤o gratis;Vendidos  1 ago 2021Art칤culo vendido;desde Estados Unidos;
Sony Playstation 1: Ehrgeiz Dios bendiga la Anillo Completo En Caja;77,60 EUR;Env칤o gratis;Vendidos  30 jul 2021Art칤culo vendido;desde Estados Unidos;
Ehrgeiz Dios bendiga la Anillo PlayStation 1 PS1;30,18 EUR;Env칤o gratis;Vendidos  29 jul 2021Art칤culo vendido;desde Estados Unidos;
Ehrgeiz (Sony PlayStation 1, 1999) Completo en Caja Muy Buen Estado PS1;81,92 EUR;+7,33 EUR de env칤o;Vendidos  25 jul 2021Art칤culo vendido;desde Estados Unidos;
Sony PS 1 PlayStation 1 Ehrgeiz Dios bendiga a la ex-Alquiler Anillo Juego Completo;73,30 EUR;Env칤o gratis;Vendidos  24 jul 2021Art칤culo vendido;desde Estados Unidos;
Ehrgeiz Dios bendiga la Anillo Sony PlayStation 1 PS1 no Manual Probado;64,67 EUR;Env칤o gratis;Vendidos  18 jul 2021Art칤culo vendido;desde Estados Unidos;
Ehrgeiz Sony PlayStation 1 Sin Juego;43,12 EUR;+4,74 EUR de env칤o;Vendidos  16 jul 2021Art칤culo vendido;desde Estados Unidos;
Usado PS1 PlayStation 1 Ehrgeiz de Jap칩n;7,09 EUR;+8,19 EUR de env칤o;Vendidos  14 jul 2021Art칤culo vendido;desde Jap칩n;
Colecci칩n Del Milenio Playstation PS1 Cuadrado Ehrgeiz/Dios bendiga el anillo;603,62 EUR;+8,36 EUR de env칤o;Vendidos  13 jul 2021Art칤culo vendido;desde Jap칩n;
Ehrgeiz-Playstation-caso de reemplazo-Sin juego;6,89 EUR;Env칤o gratis;Vendidos  12 jul 2021Art칤culo vendido;desde Estados Unidos;
Ehrgeiz - Sony Playstation 1 PS1 - Box and manual Only;30,36 EUR;+14,29 EUR de env칤o;Vendidos  12 jul 2021Art칤culo vendido;desde Canad치;
Sony Black Label Playstation PS1 Juegos Lote Sif칩n Filtro Medalla de Honor Ehrgeiz;90,54 EUR;Env칤o gratis;Vendidos  11 jul 2021Art칤culo vendido;desde Estados Unidos;
