Sony Playstation 1 Bushido Blade 2 w/spine card Japan Version;39,90 EUR;+ 17,90 EUR de envío;desde España;
Sony PlayStation PS1 Bushido Blade w/obi Japan version;29,90 EUR;+ 17,90 EUR de envío;desde España;
Bushido Blade-PS1 (Sony Playstation 1) COMPLETA (PAL);52,53 EUR;+ 17,34 EUR de envío estimado;desde Reino Unido;
Bushido Blade Sony PlayStation Ps1 Pal Fr Squaresoft Tekken Soulblade;25,00 EUR;Envío no especificado;desde Francia;
Bushido Blade - Notice Sony Playstation PS1 (FR) - PAL;5,90 EUR;+ 5,50 EUR de envío;desde Francia;
Bushido Blade PS1 Playstation PAL lucha espadas Probado Funcionando One PS2;29,13 EUR;+ 16,92 EUR de envío estimado;desde Reino Unido;
Bushido Blade PS1 Black Label lucha Sony Playstation NO DISCO;21,00 EUR;+ 16,77 EUR de envío estimado;desde Reino Unido;
Sony PS1 Playstation Bushido Blade Juego PAL;25,67 EUR;+ 14,59 EUR de envío;desde Reino Unido;
Bushido Blade-PS1 (Sony Playstation 1) (PAL) Black Label-Sin Manual;17,50 EUR;+ 16,71 EUR de envío estimado;desde Reino Unido;
Bushido Blade Sony PlayStation 1 PS1 PAL Version Promo Raro;10,45 EUR;+ 20,02 EUR de envío estimado;desde Reino Unido;
Bushido Blade-Sony Playstation/PS1/PS-disco solamente-PAL One;8,06 EUR;+ 11,56 EUR de envío;desde Portugal;
Bushido Blade De Vídeo Juego Para Sony PlayStation PS1 NTSC-J Japonés 86020;17,50 EUR;+ 16,71 EUR de envío estimado;desde Reino Unido;
Bushido Blade 2-Japón NTSC PlayStation 1 PS1 Sony;17,50 EUR;+ 16,71 EUR de envío estimado;desde Reino Unido;
Bushido Blade-PS1 (Sony Playstation 1) COMPLETA (PAL) Black Label Raro Juego;26,83 EUR;+ 19,19 EUR de envío estimado;desde Reino Unido;
Bushido Blade - Sony Playstation - PS1 PSX - JAP Japan;16,50 EUR;+ 15,00 EUR de envío;desde Italia;
Bushido Blade PlayStation NTSC-J Japan Import;18,99 EUR;+ 18,50 EUR de envío;desde España;
Bushido Blade 2 PlayStation NTSC-J Japan Import;9,99 EUR;+ 18,50 EUR de envío;desde España;
Bushido Blade - PS1 Complet Version Française PlayStation;29,95 EUR;+ 10,00 EUR de envío;desde Francia;
Bushido Blade - Sony Playstation - PS1 PSX - JAP Japan;15,00 EUR;+ 15,00 EUR de envío;desde Italia;
Bushido Blade (Sony PlayStation 1, 1997) nos PS1;42,25 EUR;+ 17,25 EUR de envío;desde Rusia;
El Bushido Blade OVP + instrucciones (Sony PlayStation 1/2) ps1 juego;21,90 EUR;Envío no especificado;desde Alemania;
Revista Play edición 30 de febrero de 1998 Playstation Bushido Blade opiniones y muchos más;10,51 EUR;+ 16,58 EUR de envío estimado;desde Reino Unido;
Bushido Blade Guía De Estrategia-Sony Playstation 1-japonés;10,85 EUR;+ 6,83 EUR de envío;desde Reino Unido;
Total PlayStation Magazine - Issue 28- Includes original Bushido Blade Tips Book;7,01 EUR;+ 24,37 EUR de envío estimado;desde Reino Unido;
Bushido Blade un juego para Playstation 1;26,84 EUR;+ 8,76 EUR de envío;desde Reino Unido;
Magazine CD Consoles - Numéro 36 - Février 1998 - Bushido Blade -Tekken 3;10,00 EUR;+ 7,50 EUR de envío;desde Francia;
Masters of Bushido Blade - U.K. - Playstation 2 - En Muy Buen Estado - 330721040;11,59 EUR;Envío no especificado;desde España;
Ps1 el Bushido Blade OVP Sony PlayStation 1 best seller USK 18;21,89 EUR;Envío no especificado;desde Alemania;
PS1 Bushido Blade Emb.orig sony PLAYSTATION 1 Superventas USK 18;22,26 EUR;Envío no especificado;desde Alemania;
Sony PS1 Playstation - Bushido Blade - VERSIÓN JAPÓN;14,90 EUR;+ 17,90 EUR de envío;desde España;
