Motostorm ps3 PlayStation 3 juego PS 3 todoterreno carrera quad Buggy rally camiones bikes;6,90 EUR;Envío no especificado;Vendidos  31 ago 2021Artículo vendido;desde Alemania;
Buggy para la ps1 PlayStation 1 SLES 00174;5,00 EUR;Envío no especificado;Vendidos  22 ago 2021Artículo vendido;desde Alemania;
Buggy-SONY PLAYSTATION PSONE PS1 Juego-Estado Coleccionable!;15,14 EUR;+ 11,66 EUR de envío;Vendidos  30 jul 2021Artículo vendido;desde Reino Unido;
Offroad Racing: Buggy X ATV X Moto (Sony PlayStation 4, 2019) PS4. completa!;19,39 EUR;Envío gratis;Vendidos  30 sep 2021Artículo vendido;desde Estados Unidos;
Offroad Racing: Buggy X ATV X Moto (Sony PlayStation 4, 2019) PS4;18,97 EUR;Envío gratis;Vendidos  15 sep 2021Artículo vendido;desde Estados Unidos;
1/8 RC Coche Trasera Con Polea Wheelie Bar Kits para Rovan Buggy 83006 HPI Savage XL;11,66 EUR;+ 4,65 EUR de envío;Vendidos  27 sep 2021Artículo vendido;desde China;
Para WPL D12 RC Camión Automóvil parte de Metal Jaula Antivuelco Marco de Cubo Trasero Buggy actualización;22,78 EUR;+ 4,65 EUR de envío;Vendidos  16 sep 2021Artículo vendido;desde China;
